id,title,type,organizer,location,deadline,link,source,tags
48,Single Source for Establishing Pilot/Opportunity program for AI Models to Accelerate Diabetes Research (U24- Clinical Trials not allowed),Grant,US Federal Agency,United States,,https://www.grants.gov/search-results-detail/360657,Grants.gov,"On-site, Any Stage, Funded"
54,AI3 Action Institute - Artificial Intelligence for American Indians,Grant,US Federal Agency,United States,,https://www.grants.gov/search-results-detail/362270,Grants.gov,"On-site, Any Stage, Funded"
55,Novel Experiential Technologies Assisting Individual Learning (NExT AI) Hubs,Grant,US Federal Agency,United States,,https://www.grants.gov/search-results-detail/359949,Grants.gov,"On-site, Any Stage, Funded"
56,Mass Market Solutions for Leveraging Robotics and AI Technologies for Home Construction Demonstration,Grant,US Federal Agency,United States,,https://www.grants.gov/search-results-detail/362360,Grants.gov,"On-site, Any Stage, Funded"
63,"U.S. Administration on Aging, National Resource Centers on Older Indians, Alaska Natives and Native Hawaiian Programs",Grant,US Federal Agency,United States,,https://www.grants.gov/search-results-detail/355786,Grants.gov,"On-site, Any Stage, Funded"
50,TechAccess: AI-Ready America,Grant,US Federal Agency,United States,07/16/2026,https://www.grants.gov/search-results-detail/361664,Grants.gov,"On-site, Any Stage, Funded"
46,CyberAICorps Scholarship for Service,Grant,US Federal Agency,United States,07/21/2026,https://www.grants.gov/search-results-detail/361238,Grants.gov,"On-site, Any Stage, Funded"
51,The Genesis Mission:  Transforming Science and Energy with AI,Grant,US Federal Agency,United States,12/17/2026,https://www.grants.gov/search-results-detail/361526,Grants.gov,"On-site, Any Stage, Funded"
